id_NUMBER,ITEM_NAME,TITLE,MAKER,DATE_MADE,PLACE_MADE,MATERIALS,MEASUREMENTS,DESCRIPTION,WHOLE_PART,COLLECTION
1916-131,pocket watch,"Pocket Watch in Gold Case with Enamel Decoration, 1740-1760",Le Roy,1740-1760,France,"gold (metal); enamel; brass (copper, zinc alloy)","overall: 13 mm x 44 mm x 52 mm, .05kg","Verge watch in gold enamelled case by Le Roy, (eleve de Breguet), no.30279, oriental dial, 1740-1760. The back of the gold case is decorated with a river landscape.",WHOLE,SCM - Time Measurement
1926-251,compensation balance,"Compensation Balance by Kullberg, 1860-1880","Kullberg, Victor",1860-1880,"London, Greater London, England, United Kingdom","steel (metal); brass (copper, zinc alloy)",overall: 9 mm x 35 mm,"Compensation balance by Victor Kullberg, London, England, 1860-1880.",WHOLE,SCM - Time Measurement
1926-992,sundial,"Primitive Egyptian Altitude Sundial or Shadow Clock, 1000-800 BCE",Unknown maker,1000-800 BCE,Qus; Egypt,wood; tin,,"Primitive time measuring device consisting of wooden board with horizontal wooden gnomen or 'goal posts', the position of the shadow cast by this traverse piece indicates the passage of time, Unsigned, Egypt, 1000-800 BCE",WHOLE,SCM - Time Measurement
1927-1981,pendulum clock; reconstruction,"Reproduction of Huygens clock movement (from ""Horologium Osc",J. Morrison and Sons,1927,"London, Greater London, England, United Kingdom",seconds dial: brass,,"Reproduction of Huygens clock movement (from ""Horologium Oscillatorium"" 1673) with brass seconds dial and additional minutes dial and seconds dial",WHOLE,SCM - Time Measurement
1928-207,pocket sundial,Chinese pocket sundial and compass,,1770-1880,China,"wood (unidentified); brass (copper, zinc alloy); glass","overall: 17 mm x 53 mm x 118 mm, weight: 0.05kg","Pocket sundial in wood, including compass and folding brass gnomon (about 2 1/2 x 4 3/4-inches overall), China, 1770-1880. For use at latitude 35°N. Inclination adjustable by means of hinged strut - thirteen notches corresponding to thirteen solar periods of the year. Table engraved on dial.",WHOLE,SCM - Time Measurement
1928-208,,Bain Electric clock movement (incomplete - crutch,"Bain, Alexander",1840-1877,,,"overall: 715 mm x 305 mm x 200 mm,","Bain Electric clock movement (incomplete - crutch, contacts, dial and contact maker missing)",WHOLE,SCM - Time Measurement
1928-300,mock-up; escapement,"Model of Lever Escapement, Unsigned, 1860-1928",Unknown maker,1860-1928,United Kingdom,"brass (copper, zinc alloy); steel (metal); copper (metal)","overall: 135 mm x 230 mm x 310 mm,","Model of lever escapement, Unsigned, 1860-1928",WHOLE,SCM - Time Measurement
1928-301,,Watch movement by R,"Markham, R. (maker)",,,,,Watch movement by R. Markham with experimental escapement (incomplete),WHOLE,SCM - Time Measurement
1928-302,,Small timepiece movement with helical gearing (incomplete),,,,,"overall: 92 mm x 52 mm x 74 mm,",Small timepiece movement with helical gearing (incomplete),WHOLE,SCM - Time Measurement
1928-674,,Small clock with conical pendulum in pieces,,,,,,Small clock with  conical pendulum in pieces,WHOLE,SCM - Time Measurement
1928-721,clock,"Japanese Weight-Driven Clock, Unsigned, 1800-1890",Unknown maker,1800-1890,Japan,"wood (unidentified); brass (copper, zinc alloy); steel (metal)","overall: 410 mm x 70 mm x 35 mm,","Japanese clock (weight missing), unsigned, 1800-1890",WHOLE,SCM - Time Measurement
1928-722,lantern clock; weight-driven balance wheel clock,Brass lantern clock,"Webb, Edward",1688,"Chew Stoke, Somerset, England, United Kingdom","brass (copper, zinc alloy); steel (metal)","overall: 406 mm x 55 mm x 62 mm, weight: 5.95kg","Brass lantern clock by Edward Webb, Chew Stoke, Somerset, England, 1688, (weight missing), with case.",WHOLE,SCM - Time Measurement
1928-1054,weight-driven balance wheel clock,"German wooden clock, with foliot type escapement",,1669,Germany,"steel (metal); wire; brass (copper, zinc alloy); iron; wood (unidentified)","overall: 360 mm x 185 mm x 210 mm, weight: 3.15kg","Wooden clock, with foliot type escapement, Germany, 1669 (driving weights missing).",WHOLE,SCM - Time Measurement
1928-1182,diagram,Diagram of cylinder escapement,Science Museum,1928,"London, Greater London, England, United Kingdom",,overall: 170 mm x 150 mm,Diagram of cylinder escapement,WHOLE,SCM - Time Measurement
1928-1183,diagram,Diagram of Breguet's cylinder escapement,Science Museum,1928,"London, Greater London, England, United Kingdom",,"overall: 140 mm x 147 mm,",Diagram of Breguet's cylinder escapement,WHOLE,SCM - Time Measurement
1928-1184,diagram,Diagram of English Lever escapement,Science Museum,1928,"London, Greater London, England, United Kingdom",,overall: 136 mm x 141 mm,Diagram of English Lever escapement,WHOLE,SCM - Time Measurement
1928-1185,diagram,Diagram of Club Tooth Lever escapement,Science Museum,1928,"London, Greater London, England, United Kingdom",,overall: 184 mm x 136 mm,Diagram of Club Tooth Lever escapement,WHOLE,SCM - Time Measurement
1928-1188,diagram,Diagram of Virgule escapement,Science Museum,1928,"London, Greater London, England, United Kingdom",,overall: 145 mm x 120 mm,Diagram of Virgule escapement,WHOLE,SCM - Time Measurement
1928-1189,diagram,Diagram of Duplex escapement,Science Museum,1928,"London, Greater London, England, United Kingdom",,,Diagram of Duplex escapement,WHOLE,SCM - Time Measurement
1916-272,instrument component; pocket watch,Movement with rack-lever escapement,Whitehurst and Son (maker),1805-1846,"Derby, Derbyshire, England, United Kingdom",,,"Movement with rack-lever escapement, no.716, Whitehurst and Son, Derby, incomplete, 1805-1846, donated by Evan Roberts in 1916",WHOLE,SCM - Time Measurement
1916-275,instrument component; pocket watch,"Movement with rack-lever escapement no.4824, R. Roskell","Roskell, Robert",1800-1830,"Lancashire, England, United Kingdom",,,"Movement with rack-lever escapement no.4824, R. Roskell, Lancashire, England, 1800-1830, donated by Even Roberts in 1916",WHOLE,SCM - Time Measurement
1918-95,compass sundial,Brass Compass and Sundial,Walker and Son,1802-1819,"Dublin, Ireland","brass (copper, zinc alloy); glass; steel (metal)","overall: 18 mm x 92.075 mm, weight: 0.265kg","Pocket sundial and compass with brass cap, 3 5/8-inch diameter, by Walker and Son, Dublin, Ireland, 1802-1819. For use at latitude 51.5° (see note).",WHOLE,SCM - Time Measurement
1918-97,universal equinoctial sundial,"Universal sundial, by Sadtler of Vienna",Sadtler,1701-1800,"Vienna, Wien, Austria",,,"Universal sundial, by Sadtler of Vienna",WHOLE,SCM - Time Measurement
1918-98,Universal ring sundial,"4"" Universal ring dial, late 17th or early 18th century",,1676-1725,,,,"4"" Universal ring dial, late 17th or early 18th century",WHOLE,SCM - Time Measurement
1919-2,Analemmatic sundial,"Analemmatic sundial, brass, by Tuttell, late 17th century (g",Tuttell (maker),1698-1702,"London, Greater London, England, United Kingdom",,,"Analemmatic sundial, brass, by Tuttell, late 17th century (gnomons imperfect)",WHOLE,SCM - Time Measurement
1919-324,universal ring sundial,Universal Ring Dial,,1701-1800,Europe,"brass (copper, zinc alloy)","overall: 4 mm x 92.075 mm, weight: 0.09kg","Universal ring dial, brass, 3 5/8-inch outside diameter, Europe, 1701-1800.",WHOLE,SCM - Time Measurement
1920-360,sand glass,"Common sand glass, in case",,1801-1900,,glass; sand,,"Common sand glass, in case",WHOLE,SCM - Time Measurement
1923-404,equinoctial sundial,"Universal sundial dated 1764, engraved ""Filippo et Hover Fra",Filippo et Hover,1764,,,,"Universal sundial dated 1764, engraved ""Filippo et Hover Fratelli De Bianchy 4 No.8, 1764 with leather case",WHOLE,SCM - Time Measurement
1923-584,clocks; sundials; altitude dials with gnomons; drawings; shadow clocks,Plaster copy of an Egyptian shadow clock.,,,,plaster,,"Plaster copy of an Egyptian Shadow Clock, without cross-piece, which is missing from the original and a drawing in frame",WHOLE,SCM - Time Measurement
1916-276,spring-driven watch mechanism; rack-lever escapement,Pocket watch mechanism,"Roskell, R.",1750-1805,"Liverpool, Merseyside, England, United Kingdom","enamel; brass (copper, zinc alloy); steel (metal)","overall: 13 mm x 46 mm, weight: 0.08kg","Movement with rack-lever escapement no.8225, by R. Roskell, Liverpool, England, 1750-1805, incomplete.",WHOLE,SCM - Time Measurement
1916-278,movement - clockwork; duplex watch,Movement with double wheel duplex escapement,"Vincent, Charles (maker)",1820,"London, Greater London, England, United Kingdom",,,"Movement with double wheel duplex escapement by Charles Vincent, London, incompelete, 1820, donated by Even Roberts in 1916",WHOLE,SCM - Time Measurement
1916-280,instrument component; pocket watch,Alarm watch movement with French verge escapement,"Japy, Frederic",,"Beaucourt, France",,,"Alarm watch movement with French verge escapement, by Japy, with wire gong, Frederic Japy, Beaucourt, France, 1749-1813, donated by Evan Roberts in 1916",WHOLE,SCM - Time Measurement
1916-281,spring-driven watch mechanism; verge escapement,"Movement with club-footed verge escapement, no. 1260, Jas. H","Houghton, J.",,"Ormskirk, Lancashire, England, United Kingdom",,,"Movement with club-footed verge escapement, no. 1260, Jas. Houghton, Ormskirk, incomplete and damaged",WHOLE,SCM - Time Measurement
1916-284,instrument component; pocket watch,"Movement with lever escapement, no",Daniels (maker),1820,"Liverpool, Liverpool, Merseyside, England, United Kingdom",,,"Movement with lever escapement, no.8802, Daniels, Liverpool, incomplete and damaged, 1820, donated by Evan Roberts in 1916",WHOLE,SCM - Time Measurement
1916-286,instrument component; pocket watch,Alarm watch movement with French verge escapement,Meuron and Co. (maker),1798,"Paris, Ville de Paris, Île-de-France, France",,,"Alarm watch movement, no.11471, Meuron and Co., with French verge escapement, incomplete, 1798, Paris, donated by Evan Roberts in 1916",WHOLE,SCM - Time Measurement
1916-287,instrument component; pocket watch,Bar movement with Geneva lever escapement,Unknown maker,1801-1900,Switzerland,,,"Bar movement with Geneva lever escapement no.16670, incomplete, 1801-1900, Switzerland, donated by Evan Roberts in 1916",WHOLE,SCM - Time Measurement
1916-293,instrument component; pocket watch,Small movement with vergule escapement,"Vaucher, Daniel",1767-1786,"Paris, Ville de Paris, Île-de-France, France",,,"Small movement by Vauchez, Paris, vergule escapement but balance wheel and accessories missing, no hands, 1767-1786, donated by Evan Roberts in 1916",WHOLE,SCM - Time Measurement
1916-297,instrument component; pocket watch,Movement with French verge escapement,Breguet,1775-1800,France,,,"Movement with French verge escapement no.9491, Breguet, dial damaged, France, 1775-1800, donated by Evan Roberts in 1916",WHOLE,SCM - Time Measurement
1916-298,spring-driven watch mechanism; cylinder escapement,"Flat movement with horizontal escapement no. 23093, F. and A",F. and A. Meylan,,"Geneva, Geneva canton, Switzerland",,,"Flat movement with horizontal escapement no. 23093, F. and A. Meylan, Geneva, incomplete ( no dial etc., part of regulator missing)",WHOLE,SCM - Time Measurement
1916-299,pocket watch; cylinder watch,"Swiss or French movement with horizontal escapement including ""Jumper"" mechanism",Unknown maker,1801-1900,Switzerland; France,,,"Swiss or French movement with horizontal escapement including ""Jumper"" mechanism, damaged (cylinder broken), incomplete (dial etc. missing) no.390, 1801-1900",WHOLE,SCM - Time Measurement
1916-321,equinoctial sundial,Universal sundial in bronze with compass,,1701-1800,Germany,"metal (unknown); bronze (copper, tin alloy)","overall: 19 mm x 73.03 mm, weight: 0.1kg","Universal pocket sundial, octagonal base, diameter of hour circle 2 7/8-inches, small plumbob, Germany, 1701-1800 (see note).",WHOLE,SCM - Time Measurement
1917-96,cubical sundial,"Cubical sundial, on jointed pillar stand, with compass paper","Beringer, David",1751-1800,Germany,wood; paper; brass,,"Cubical sundial, on jointed pillar stand, with compass paper on wood, with brass gnomons.   Inscribed ""D. Beringer. G.R. R???fried"" [sic].",WHOLE,SCM - Time Measurement
1917-98,dipleidoscope,"Dipleidoscope with mechanical clock dial, British 1870-1890",E. Dent & Co.,1870-1890,"City of London, England, United Kingdom","brass (copper, zinc alloy); glass","overall: 130 mm x 150 mm x 140 mm,","Dent's dipleidoscope on triangular stand, with mechanical clock dial (clock glass missing), by E. Dent & Co., London, England, 1870-1890.   Used for the determination of midday to check the accuracy of mechanical timepieces",WHOLE,SCM - Time Measurement
1938-320,spring-driven watch mechanism; lever escapement; detached,"Lever watch movement by Thos. Russell and Son, with up-and-d",Thomas Russell and Son,1801-1900,,,,"Lever watch movement by Thos. Russell and Son, with up-and-down indicator for winding",WHOLE,SCM - Time Measurement
1938-321,pocket watch,"Pocket Watch with Calender in Silver Case, 1840-1880",Unknown maker,1840-1880,Europe,"silver (metal); enamel; brass (copper, zinc alloy)","overall: 16 mm x 53 mm x 77 mm, 0.13kg","Half-hunter lever watch with calendar at back giving days of the week and the month, 1840-1880",WHOLE,SCM - Time Measurement
1923-1512,,Early electric clock by Wheatstone with base and small part,"Wheatstone, Sir Charles",,,,,"Early electric clock by Wheatstone with base and small part. (Originally part of Inv.No. 1923-278, see ScM.7/636/1)",WHOLE,SCM - Time Measurement
1924-295,spring-driven pendulum mechanism; skeleton clock; pin-wheel escapement,"French clock with train remontoire, glass shade and pin whee",,1831-1870,,,,"French clock with train remontoire, glass shade and pin wheel",WHOLE,SCM - Time Measurement
1925-6,,Electric Master clock by C,"Bohmeyer, C. (maker)",,,,,"Electric Master clock by C. Bohmeyer, with one subsidiary dial, weights, 3 hands and a key (2 decorative portions of case of master clock missing)",WHOLE,SCM - Time Measurement
1925-51,cylinder escapement; timepiece mechanism; model,Model of a cylinder escapement with spare parts and winding,,,,,,Model of a cylinder escapement with spare parts and winding key,WHOLE,SCM - Time Measurement
1925-60,Diagrams,Eight prints of drawings of clock mechanisms:- Long case str,,,,,,"Eight prints of drawings of clock mechanisms:- Long case striking clock, side view; long case striking clock, going train with anchor; long case striking clock, rack striking mechanism; dead beat escapement; anchor escapement",WHOLE,SCM - Time Measurement
1925-61,Diagram,Five prints of drawings of watch escapements:- Cylinder esca,,,,,,"Five prints of drawings of watch escapements:- Cylinder escapement; Duplex escapement, Lever escapement, English form; Lever escapement, Swiss form",WHOLE,SCM - Time Measurement
1925-62,diagram,Three prints of drawings of repeater mechanisms,Unknown maker,,,paper,,"Three prints of drawings of repeater mechanisms:- Breguet watch, repeating train on bottom plate; Breguet watch, striking train on top plate; Breguet watch, going train",WHOLE,SCM - Time Measurement
1925-193,chronometer,"Chronometer movement in brass cage, fitted with dial and han","Ditisheim, Paul",1925,,"balance-spring: steel; balance wheel rim: nickel, steel; hairspring: elinvar (alloy including nickel, steel and chromium)",,"Chronometer movement in brass cage, fitted with dial and hands, lever escapement, Guillaume balance, steel hairspring, in mahogany case with glass top. One removable cage containing detent escapement, new patented Elinvar hairspring",WHOLE,SCM - Time Measurement
1925-704,tower clock; weight-driven pendulum clock,"Works of clock (dated 1671) removed from St. Giles Church, C","Clement, William",1671,"London, Greater London, England, United Kingdom",iron; brass,,"Works of clock (dated 1671) removed from St. Giles Church, Cambridge (received in pieces), including parts and weights",WHOLE,SCM - Time Measurement
1916-177,pocket watch; duplex watch,Duplex watch in triple case,"Haley, Chas (maker)",1762-1800,"London, Greater London, England, United Kingdom",,,"Duplex watch in triple pinchbeck case by Chas. Haley, London, 1762-1800, no.1341, donated by Evan Roberts in 1916",WHOLE,SCM - Time Measurement
1916-178,pocket watch; duplex watch,Duplex watch in case,"Berthoud, Ferdinand",1747-1807,"London, Greater London, England, United Kingdom",,,"Duplex watch in silver case by F. Berthoud, London, no.10046 (re-cased). Hall marked 1890, 1727-1807, donated by Evan Roberts in 1916",WHOLE,SCM - Time Measurement
1916-179,pocket watch; duplex watch,"Pocket Watch in Guilt Silver Case by Thomas Earnshaw, 1810-1824","Earnshaw, Thomas",hallmarked 1824,"London, England","brass (copper, zinc alloy); enamel; silver; gilding; hallmark; chronological; timers; regulating; double action; free-standing; springs (elastic objects)","overall: 19 mm x 70 mm, 0.125kg","Duplex watch in gilt silver case by Thos. Earnshaw, 119 High Holborn, no.4521. Hall marked 1824 (seconds hand missing, balance staff broken)",WHOLE,SCM - Time Measurement
1916-180,pocket watch; duplex watch,"Duplex Pocket Watch in Silver Case by Molyneux and Sons, 1815-1830",Molyneux and Sons,hallmarked 1830,"England, United Kingdom","enamel; brass (copper, zinc alloy); silver; hallmark; chronological; hinges (fasteners); timers; regulating; double action; free-standing; springs (elastic objects)","overall (open): 64 mm x 57 mm x 80 mm, 0.135kg","Duplex watch in silver hunter case by Molyneux and Sons, no.1368. Hall marked 1830 ( seconds hand missing)",WHOLE,SCM - Time Measurement
1916-184,chronometer,"Chronometer watch in silver case by John Arnold and Son, Lon",John Arnold and Son,hallmarked 1788,"London, Greater London, England, United Kingdom",case: silver,,"Chronometer watch in silver case by John Arnold and Son, London, no.360/661, case. Hall marked 1788",WHOLE,SCM - Time Measurement
1916-185,chronometer,"Chronometer Watch in Silver Case, By Arnold and Son, 1850-1872",John Arnold and Son (maker),1850-1872,"London, Greater London, England, United Kingdom","silver (metal); glass; brass (copper, zinc alloy)","overall: 25 mm 69 mm, 0.12kg","Chronometer watch in silver case by John Arnold and Son, London, no.454/755. Hall marked 1872",WHOLE,SCM - Time Measurement
1916-186,chronometer,"Chronometer Watch in Silver Case, 1820-1833","Arnold, John Roger; Abbe, Cleveland",hallmarked 1833; 1820-1833,"London, Greater London, England, United Kingdom",glass; enamel; silver,"overall: 14 mm x 47 mm x 68 mm, 0.09kg","Chronometer watch in silver case by J.R. Arnold, Chas Frodsham, no.6530, 3/4 -plate movement, 1820-1833",WHOLE,SCM - Time Measurement
1916-187,chronometer,"Chronometer in Silver Case by Thomas Earnshaw, 1800-1834","Earnshaw, Thomas",1800-1834,"London, England",glass; enamel; metal (unknown); silver,"overall: 23 mm x 53 mm x 74 mm, 0.13kg","Chronometer watch in silver case by Thos. Earnshaw, London, no.422 (also 2653), 1800-1834",WHOLE,SCM - Time Measurement
1916-188,chronometer,"Chronometer in Silver Case by Thomas Earnshaw, no 837, 1810-1825","Earnshaw, Thomas",hallmarked 1825,"London, England","brass (copper, zinc alloy); enamel; silver","overall: 17 mm x 53 mm x 73 mm, 0.135kg","Chronometer watch in silver case by Thomas Earnshaw, London, no.837 (also 3669). Hall marked 1825",WHOLE,SCM - Time Measurement
1916-207,pocket watch,"Pocket Watch in Silver Inner Case by Neveren, 1715-1784",Neveren,hallmarked 1784,"London, Greater London, England, United Kingdom","brass (copper, zinc alloy); metal (unknown); silver","overall: 23 mm x 40 mm x 52 mm, 0.05kg","Verge watch in silver pair inner case only, by D.B.D. Neveren, pendulum balance, 1715-1784",WHOLE,SCM - Time Measurement
1916-232,pocket watch; repeater - timepiece,1/4 verge repeater with dial in case,Unknown maker,1801-1900,France,,,"1/4-repeater, verge, no.2742 (in case), in silver engine turned case, silver dial, French, 1801-1900, donated by Evan Roberts in 1916",WHOLE,SCM - Time Measurement
1916-234,pocket watch; repeater - timepiece,"Pocket watch with dial missing, in silver case","Berthoud, Ferdinand",1775-1790,"Paris, France","silver (metal); glass; brass (copper, zinc alloy); steel (metal)","overall: 17 mm x 55 mm x 87 mm, weight: 0.095kg","1/4-repeater, French verge, no. 976, in silver case, by Ferdinand Berthoud, Paris, France, 1775-1790. (Cock screws missing - damaged.)",WHOLE,SCM - Time Measurement
1916-235,pocket watch; repeater - timepiece,Dumb verge repeater with engine turned and ornamented case,Romilly (maker),1714-1796,"Paris, Ville de Paris, Île-de-France, France",,,"Repeater, French verge by Romilly, Paris, no.1782, in engine turned and ornamented gold case, dumb repeater, 1714-1796, donated by Evan Roberts in 1916",WHOLE,SCM - Time Measurement
1916-236,pocket watch; repeater - timepiece,1/4 verge repeater in case,Breguet,1795-1805,"Paris, Ville de Paris, Île-de-France, France",gold; chronological; repeater; timer; regulating; vertical; springs (elastic objects),,"1/4-repeater, French verge, by Breguet, Paris, no.7101 in case, 8659 under dial, in gold case (hands missing), 1795-1805, donated by Evan Roberts in 1916",WHOLE,SCM - Time Measurement
1916-238,pocket watch; cylinder watch,"Repeater, cylinder, going barrel, by Breguet, no.357, Parach",Breguet,c. 1800,,gold; silver; wire; repeater; timer; regulating; horizontal; equilibrium; springs (elastic objects),,"Repeater, cylinder, going barrel, by Breguet, no.357, Parachute and curb compensator, wire gong, in gold case, silver dial (out of order) with small gold(?) chain",WHOLE,SCM - Time Measurement
1916-239,pocket watch; cylinder watch,"1/4-repeater, cylinder escapement, English, horizontal, no.3",,hallmarked 1813,,gold; chronological; repeater; timer; regulating; horizontal; springs (elastic objects); hallmark,,"1/4-repeater, cylinder escapement, English, horizontal, no.3431 (in case), in gold case, hall marked 1913, small gold dial with hour hands and 1 small wheel",WHOLE,SCM - Time Measurement
1916-240,pocket watch; repeater - timepiece,Repeater with inner and outer pair case,"Tregent, James",1770-1805,"London, Greater London, England, United Kingdom",,,"Repeater with a gilt silver inner, pinchbeck outer pair case by Jas.  Tregent, London, no. 2299, horizontal, out of order, 1770-1805, donated by Evan Roberts in 1916",WHOLE,SCM - Time Measurement
1916-241,pocket watch; cylinder watch,"Silver Repeater Pocket Watch by Ellicott and Smith, 1830-1843",Ellicott and Smith,hallmarked 1843,"London, Greater London, England, United Kingdom","brass (copper, zinc alloy); enamel; silver; chronological; horizontal; hallmark; repeater; timer; regulating; springs (elastic objects)","overall: 26 mm x 45 mm x 76 mm, 0.115kg","Repeater watch, cylinder escapement,  in silver case by Ellicott, London, no.5083, horizontal, case hall marked 1843, out of order.",WHOLE,SCM - Time Measurement
1916-242,pocket watch; cylinder watch,"Half- Quarter Repeater Pocket Watch  by Thomas Earnshaw, 1810-1823","Earnshaw, Thomas",hallmarked 1823,"London, England","brass (copper, zinc alloy); metal (unknown); silver; chronological; repeater; horizontal; hallmark; timer; regulating; springs (elastic objects)","overall: 17 mm x 52 mm x 80 mm, 0.125kg","Half-quarter repeater watch, cylinder escapement, in silver case, hall marked 1823, by Thos. Earnshaw,119 High Holborn, London, no.4502, 1810-1823.  Dumb, cylinder, dial missing",WHOLE,SCM - Time Measurement
1916-243,pocket watch; cylinder watch,Dumb cylinder repeater in case,Barraud family,1790-1855,"London, Greater London, England, United Kingdom",,,"Repeater in silver case by Barraud, London, no.1947, operated by side slide, dumb, cylinder, 1790-1855, hall marked 1869, donated by Evan Roberts in 1916",WHOLE,SCM - Time Measurement
1916-245,pocket watch; cylinder watch,Cylinder repeater in case,"Taylor, Ellicott (maker)",1800-1840,"London, United Kingdom",,,"Repeater in silver case by Ellicott Taylor, no.9307, ruby cylinder, hall marked 1896. ( Re-cased and unfinished, hour hand missing), London, 1800-1840, donated by Evan Roberts in 1916",WHOLE,SCM - Time Measurement
1916-246,pocket watch; cylinder watch,Dumb cylinder repeater in case,De Lor (maker),,Europe,,,"Repeater in silver case by De Lor no.1414 (in case) dumb, Genova cylinder, hall marked 1842 (minute hand missing)",WHOLE,SCM - Time Measurement
1916-190,pocket watch,Rack-lever watch in pair case,P. Litherland and Company,1800,"Liverpool, Liverpool, Merseyside, England, United Kingdom",pinchbeck,,"Rack-lever watch in pinchbeck pair case by P. Litherland and Co., Liverpool, no.306, 1800, donated by Evan Roberts in 1916",WHOLE,SCM - Time Measurement
1916-191,pocket watch; roller; dial,Lever watch in case with dial and crank roller,"Weatherilt, S.",1770-1818,"Liverpool, Liverpool, Merseyside, England, United Kingdom",case: pinchbeck; dial: silver,,"Lever watch in pinchbeck case by S. Weatherill, 1770-1818, Liverpool, no.741, silver dial, (chain twisted, hand bent) crank roller, donated by Evan Roberts in 1916",WHOLE,SCM - Time Measurement
1938-359,equinoctial compass sundial,"Universal compass sundial, metal gilt, engraved and pierced,","Vogel, Andreas",1766-1800,"Augsburg, Schwaben, Bavaria, Germany",overall: gilt metal,,"Universal compass sundial, metal gilt, engraved and pierced, ""And: Vogl"". In case",WHOLE,SCM - Time Measurement
1938-360,Universal equinoctial sundial,Octagonal brass dial mounted on wood,,,,,,Octagonal brass dial mounted on wood,WHOLE,SCM - Time Measurement
1938-362,Compass horizontal sundial,"Quadrangular horizontal sundial, ivory, engraved and coloure",,1601-1700,Germany,,,"Quadrangular horizontal sundial, ivory, engraved and coloured, inlaid on wood (cracked)",WHOLE,SCM - Time Measurement
