id_NUMBER,ITEM_NAME,TITLE,MAKER,DATE_MADE,PLACE_MADE,MATERIALS,MEASUREMENTS,DESCRIPTION,WHOLE_PART,COLLECTION
1988-1465,,Set of three observatory watches with keyless lever movement,American Waltham Watch Company,c. 1900,"Waltham, Middlesex county, Massachusetts, United States",,,"Set of three observatory watches with keyless lever movements by the American Waltham Watch Company, in a fitted mahogany case. Comprising a sidereal watch with 24 hour dial and two mean time watches. c.1900",WHOLE,SCM - Time Measurement
1989-46,,Synchronome half-minute impulse electric turret clock moveme,,,,,"overall: 510 mm x 245 mm x 245 mm,",Synchronome half-minute impulse electric turret clock movement. 1963,WHOLE,SCM - Time Measurement
1989-47,,Control box made by the Synchronome Co,,,,,"overall: 500 mm x 335 mm x 190 mm,",Control box made by the Synchronome Co. to sequentially illuminate five-second segments around a turret clock dial. 1963,WHOLE,SCM - Time Measurement
1988-1484,,Model of al-Biruni's geared calendar,,,,,overall: 440 mm x 55 mm,Model of al-Biruni's geared calendar,WHOLE,SCM - Time Measurement
1989-176,electric clock,Electric clock,Reason Manufacturing Company Limited,1910-1920,"Brighton, Brighton and Hove, England, United Kingdom",wood; steel; brass; glass,overall: 365 mm x 200 mm diameter,"Electric clock with Hipp toggle switch and directly impulsed horizontal balance wheel. Patented by T J Murday in 1910 and made by the Reason Manufacturing Company Ltd., Brighton. (No 207)",WHOLE,SCM - Time Measurement
1938-414,Ivory diptych sundial,"Tablet Sundial, ivory, 4 1/8""x2 5/8"", Leonart Milre, 1649","Miller, Leonart",1649,"Nuremburg, Bavaria, Germany",,"overall: 108 mm x 68 mm x 20 mm,","Tablet Sundial, ivory, 4 1/8""x2 5/8"", Leonart Milre, 1649",WHOLE,SCM - Time Measurement
1938-415,Augsburg equinoctial sundial,"Equinoctial Dial, metal pierced and engraved and gilt inscri","Muller, Ludovicus Theodatus",1734-1770,,,"overall: 88 mm x 83 mm x 20 mm,","Equinoctial Dial, metal pierced and engraved and gilt inscribed ""L.T.M."" (Ludovicus Theodatus Muller) in case with document marked ""Elevatio Poli"" with German text. Cover glass cracked.",WHOLE,SCM - Time Measurement
1938-417,Augsburg equinoctial sundial,"Octagonal Sundial of gilt metal, ""And: Vogl""","Vogler, Andreas",1766-1800,"Augsburg, Schwaben, Bavaria, Germany",,"overall: 16 mm x 70 mm x 73 mm,","Octagonal Sundial of gilt metal, ""And: Vogl""",WHOLE,SCM - Time Measurement
1990-746,stop-watch,"Stop-watch reading to 1/10th of a second, with pin pallet le",,,,plastic (unidentified); steel (metal); metal (unknown); polypropylene,"overall: 20 mm x 140 mm x 120 mm, 0.08kg","Stop-watch reading to 1/10th of a second, with pin pallet lever escapement and plastics case (see note). Made by Smiths Industries in Great Britain, 1971",WHOLE,SCM - Time Measurement
1991-87,Synchronous motor clock,Mystery clock with synchronous electric movement,Smiths English Clocks Ltd.,1930-1940,"London, England, United Kingdom",wood (unidentified); glass; steel (metal); plastic (unidentified),overall: 200 mm x 235 mm x 70 mm,"Mystery clock with synchronous electric movement, by Smiths English Clocks Ltd., London, England, 1930-1940.",WHOLE,SCM - Time Measurement
1965-179,movement - clockwork,"Master Relay Clock Components, 1950-1959",International Time Recording Company Ltd.,1950-1959,"London, Greater London, England, United Kingdom",steel (metal); plastic (unidentified); electric components,"overall: 300 mm x 110 mm x 190 mm,","Model 601-9D clock components for master relay, found in the Master clock case, 1950-1959",WHOLE,SCM - Time Measurement
1880-37,Portable horizontal sundial with compass,"Sundial with compass, brass, gilt, base plate 8 1/2 in. by 6",,1771-1830,France,,,"Sundial with compass, brass, gilt, base plate 8 1/2 in. by 6in. overall. French, late 17th or early 18th century, in case (not original)",WHOLE,SCM - Time Measurement
1892-11,Plate horizontal sundial,"Sun-dial, brass, hexagonal hour plate, Gnomon for lat 52 deg",,1746,,,,"Sun-dial, brass, hexagonal hour plate, Gnomon for lat 52 degrees, date shown by crystogram in a latin inscription to be 1746",WHOLE,SCM - Time Measurement
1880-39,Mechanical equinoctial sundial,"Sundial, brass, partly silvered, base plate 8 1/2 in. by 10","Knitl, Franz Antoni",1671-1730,Germany,,overall: 120 (height) x 215 (base width) x 267 (base depth) mm,"Sundial, brass, partly silvered, base plate 8 1/2 in. by 10 1/2 in. overall. Engraved "" Franz Antoni Knitl FL"", German, late 17th or early 18th century, in case (not original)",WHOLE,SCM - Time Measurement
1892-14,sundial,Inscribed octagonal shaped sundial,"Schretteger, Johann",1797-1843,"Augsburg, Schwaben, Bavaria, Germany",brass,"overall: 51 mm,","Octagonal shaped sundial, brass, inscribed ""Schreteger"", 2-in. diameter, Johann Schretteger, Augsburg, Germany, 1797-1843",WHOLE,SCM - Time Measurement
1880-41,nocturnal,"Nocturnal, brass, gilt, diameter of flanged plate 4 in. Hand",,1650-1749,,,114 x 260 x 10 mm,"Nocturnal, brass, gilt, diameter of flanged plate 4 in. Handle and pointer in form of serpents, English, late 17th or 18th century with later case",WHOLE,SCM - Time Measurement
1976-520,,Weight-driven shelf regulator by Benjamin Martin,"Martin, Benjamin",,,,,Weight-driven shelf regulator by Benjamin Martin,WHOLE,SCM - Time Measurement
1976-521,,Cristalonic Solar quartz time computer with box and display,Cristalonic GmbH (maker),,,,,Cristalonic Solar quartz time computer with box and display stand,WHOLE,SCM - Time Measurement
1976-585,,Derby Electronic world timer DC 2969 with box,"Ebauches, S.A. (maker)",,"Neuchâtel, Neuchâtel, Switzerland",,,Derby Electronic world timer DC 2969 with box,WHOLE,SCM - Time Measurement
1976-592,,"Pair of synchronous clocks, one for 60 Hz mains and the othe",General Time,,"Scotland, United Kingdom",,,"Pair of synchronous clocks, one for 60 Hz mains and the other for 50 Hz mains",WHOLE,SCM - Time Measurement
1977-295,quartz analogue/LED digital wristwatch,Zenith quartz watch type 020010471 with both analogue and di,Zenith Time Co. (maker),1976,"Andover, Hampshire, England, United Kingdom",,,"Zenith quartz watch type 020010471 with both analogue and digital (LED) display, 1976 with box",WHOLE,SCM - Time Measurement
1977-457,,Night-light clock (early 20th century) (shade cracked and in,,,,,,Night-light clock (early 20th century) (shade cracked and index damaged),WHOLE,SCM - Time Measurement
1977-533,,Memory master clock by Engish Clock Systems 1962,English Clock Systems (maker),1962,,,,Memory master clock by Engish Clock Systems 1962,WHOLE,SCM - Time Measurement
1977-579,,"Junghans Astro-Chron model 38/0001 quartz clock, 1967 with c",Gebr Junghans of Schramberg; E.A. Combs (Clocks) Ltd.,,,,,"Junghans Astro-Chron model 38/0001 quartz clock, 1967 with case",WHOLE,SCM - Time Measurement
1977-699,clock,Wall electric clock by Campiche of Geneva,Campiche (maker),1940-1977,"Geneva, Switzerland","wood (unidentified); glass; brass (copper, zinc alloy); enamel; steel (metal)",overall: 150 mm x 745 mm x 280 mm,"Wall electric clock by Campiche, Geneva, Switzerland, 1940-1977.",WHOLE,SCM - Time Measurement
1978-24,master clock; pendulum clock; electric clock,"""High Movement"" master clock by the Telephone Manufacturing",Telephone Manufacturing Co. (maker),1950,"Bletchley, Milton Keynes, England, United Kingdom",,,"""High Movement"" master clock by the Telephone Manufacturing Co. c.1950",WHOLE,SCM - Time Measurement
1978-208,,"Clock dial marked ""Potter, Railway Time"" with two hands",,,,,overall: 255 mm x 454 mm,"Clock dial marked ""Potter, Railway Time"" with two hands",WHOLE,SCM - Time Measurement
1978-252,,Two connecting wires and two staples from Bain's electric cl,"Bain, Alexander",,,,,"Two connecting wires and two staples from Bain's electric clock installations at St. John's Church, Loughton, and at Great Wenham Church",WHOLE,SCM - Time Measurement
1978-366,,Princeps electric master clock with pendulum,,,,,,"Princeps electric master clock with pendulum. Dial marked Princeps, 173 New Bond Street. Patents applied for.",WHOLE,SCM - Time Measurement
1978-486,,"Sir William Thomson's centrifugal clock by James White, Glas","White, James (maker)",,"Glasgow, Scotland, United Kingdom",,,"Sir William Thomson's centrifugal clock by James White, Glasgow",WHOLE,SCM - Time Measurement
1978-543,,"""Tiffany Neverwind"", electric clock with torsion pendulum",,,,,overall: 152 mm x 235 mm,"""Tiffany Neverwind"", electric clock with torsion pendulum",WHOLE,SCM - Time Measurement
1978-590,,"Bulle electric clock, minute hand and glass dome missing",,,,,overall: 228 mm x 165 mm,"Bulle electric clock, minute hand and glass dome missing",WHOLE,SCM - Time Measurement
1978-592,,Electric wall clock by Paul Garnier (No 78) based on the des,"Garnier, Paul (maker); Fery, Charles, Prof. (designer)",1924,,,"overall: 795 mm x 335 mm x 150 mm,","Electric wall clock by Paul Garnier (No 78) based on the design of Professor Charles Fery,  c.1924",WHOLE,SCM - Time Measurement
1979-6,,"Tuning fork for operating a time-marker, by the Cambridge In",Cambridge Instrument Company Limited,,,,,"Tuning fork for operating a time-marker, by the Cambridge Instrument Co. Ltd. (No.L - 105235)",WHOLE,SCM - Time Measurement
1979-472,,"Copal, battery electric, digital alarm clock, tuning fork mo",,1975-1979,Japan,aluminium (metal); steel (metal); steel (metal); copper (metal); electrical components; electronic components; cardboard; paper (fibre product),"overall (box): 140 mm x 265 mm x 130 mm,; overall (clock): 95 mm x 215 mm x 95 mm, Wt. 0.813kg","Copal, battery electric, digital alarm clock, tuning fork movement with magnetic escapement by Copal Co. Ltd., Japan, 1975-1979.",WHOLE,SCM - Time Measurement
1979-485,,Digital watch made in accordance with Joseph Pallweber's pat,,,,,,Digital watch made in accordance with Joseph Pallweber's patent of 1882,WHOLE,SCM - Time Measurement
1979-632,,"Carriage clock by Wurtel, Paris with hour and half hour stri",Wurtel (maker),1845,"Paris, France","brass (copper, zinc alloy); glass; steel (metal); enamel",overall: 142 mm x 92 mm x 82 mm,"Carriage clock by Wurtel, Paris, France, c. 1845, with hour and half hour striking, alarm and calendar.",WHOLE,SCM - Time Measurement
1964-331,pocket watch,"Pocket Watch in Silver Case by Thierry, 1685-1695",Thierry,1685-1695,"Caen, Calvados, Basse-Normandie, France","brass (copper, zinc alloy); glass; silver; ornament; pierced; champlevé; ornament; chronological; vertical; curved; repeater; timer; regulating; springs (elastic objects)","overall: 32 mm x 58 mm x 67 mm, 0.19kg","Large quarter-repeating verge watch by Thierry a Caen, No.401, with silver bridge-cock, visible curved rack regulator, 1685-1695. Winding through dial. In silver pierced case with champleve dial",WHOLE,SCM - Time Measurement
1964-332,spring-driven watch; verge escapement; pocket watch,Pocket watch with silver on case,"Lestourgeon, David",1655-1665,"Rouen, France",silver (metal); glass,"overall: 23 mm x 55 mm, weight; 0.08kg","Verge watch with tangent-screw set-up to mainspring, gut line on fusee and no balance-spring. Single hand. Outer case with silver pique, by David Lestourgeon, Rouen, France, 1655-1665.",WHOLE,SCM - Time Measurement
1964-333,Butterfield-type horizontal sundial,Pocket sundial with adjustable bird gnomon and scales for la,,,,,,Pocket sundial with adjustable bird gnomon and scales for latitude 48 and 52 degrees on rings mounted above a large compass. In wooden box with hinged lid,WHOLE,SCM - Time Measurement
1965-234,diorama,"Diorama Demonstrating Manual Control of Street Lights, 1960-1965",Unknown maker,1960-1965,Unknown place,plaster; papier-mâché; paint,"overall: 660 mm x 500 mm x 580 mm,","Diorama showing hand-lighting of gas street-lamps by lamplighter, 1960-1965",TOP,SCM - Time Measurement
1965-305,,Breguet travelling clock no,Breguet (maker),,"Paris, Ville de Paris, Île-de-France, France",,,"Breguet travelling clock no.2848 with Robin escapement and grande sonnerie, alarm and pull-quarter repeat, in original fitted case. With one winding key and certificate no.3032",WHOLE,SCM - Time Measurement
1965-307,bracket clock,Bracket clock by,Tompion & Banger,,"London, England, United Kingdom","glass; wood (unidentified); steel (metal); brass (copper, zinc alloy)","overall: 293 mm x 210 mm x 135 mm, weight: 4.95kg","Bracket clock, no. 429, by Thomas Tompion and Edward Banger, London, England. With verge escapement, mock pendulum, strike/silent and regulator dials and pull-quarter repeat. With one door key",WHOLE,SCM - Time Measurement
1966-153,balance wheel analogue wristwatch,"Smith's ""Everest"" shockproof watch with presentation box",Smith Industries Ltd. (maker),,,,,"Smith's ""Everest"" shockproof watch with presentation box",WHOLE,SCM - Time Measurement
1966-374,wrist- watch; self-winding watch,"Rolex 'Oyster Perpetual' wristwatch, 1931.",Montres Rolex SA,1931,"Geneva, Switzerland",leather; steel (metal); metal (unknown); glass,"overall: 12 mm x 233 mm x 34 mm, weight: 0.035kg","Rolex 'Oyster Perpetual' rotor self-winding wrist-watch, lever escapement, in steel case with glass in back, Montres Rolex SA, Geneva, Switzerland, 1931 (see note).",WHOLE,SCM - Time Measurement
1966-375,wrist-watch,"Copy of Rolex Oyster Wrist Watch, 1960",Montres Rolex SA (maker),1960,"Geneva, Geneva canton, Switzerland",stainless steel; glass,"overall: 36 mm x 105 mm x 49 mm, 0.235kg","Duplicate of a Rolex Oyster wristwatch of 1960 which remained waterproof at 7 miles depth (without movement). Case back marked ""35789 FEET  10908 METRES  21  ROLEX  23.1.60"".",WHOLE,SCM - Time Measurement
1968-434,,Electrically driven tuning fork,Post Office Engineering Depart. (maker),,,,"overall: 165 mm x 222 mm x 320 mm,",Electrically driven tuning fork,WHOLE,SCM - Time Measurement
1968-435,,Phonic wheel no.5 (due to Dr. D.W. Dye),Post Office Engineering Depart. (maker),,,,"overall: 215 mm x 175 mm x 298 mm,",Phonic wheel no.5 (due to Dr. D.W. Dye),WHOLE,SCM - Time Measurement
1968-436,,Power panel res. 11423 DGM res 20713 and cables,Post Office Engineering Depart. (maker),,,,"overall: 222 mm x 240 mm x 483 mm,",Power panel res. 11423 DGM res 20713 and cables,WHOLE,SCM - Time Measurement
1968-437,,Amplifier,Post Office Engineering Depart. (maker),,,,"overall: 138 mm x 155 mm x 356 mm,",Amplifier,WHOLE,SCM - Time Measurement
1968-438,,Centre-seconds impulse dial for seconds impulses,Post Office Engineering Depart. (maker),,,,"overall: 185 mm x 105 mm x 183 mm,",Centre-seconds impulse dial for seconds impulses,WHOLE,SCM - Time Measurement
1968-590,Universal ring sundial,Brass Equinoctial Ring Dial. Signed H. Sutton Fecit 1660. 10,"Sutton, Henry",1660,,,,Brass Equinoctial Ring Dial. Signed H. Sutton Fecit 1660. 10.7 cms diameter,WHOLE,SCM - Time Measurement
1968-624,drawing; clock - regulator,"""Loose-leaf booklet containing text, photographs and drawing","Summers, Henry Hall (maker)",1921-1923,,,,"""Loose-leaf booklet containing text, photographs and drawings of two calendar regulator clocks with gravity escapement made by Henry Hall Summers, c.1921-23""",WHOLE,SCM - Time Measurement
1968-677,wrist-watch; self-winding watch,Harwood self-winding wrist-watch,Harwood (maker),,,,,Harwood self-winding wrist-watch,WHOLE,SCM - Time Measurement
1969-138,watch mechanism,'Sectronic' electric time mechanism,Smith Industries Ltd. (maker),1950-1965,United Kingdom,"electric components; plastic (unidentified); brass (copper, zinc alloy); steel (metal)",overall: 66 mm x 56 mm x 75 mm,"'Sectronic' transistorised electric timepiece movement Mark 2A in perspex case, by Smith Industries Ltd., United Kingdom, 1950-1965.",WHOLE,SCM - Time Measurement
1969-322,,"Clinker type electric clock, with spare glass domes and pend",,,,,,"Clinker type electric clock, with spare glass domes and pendulum.",WHOLE,SCM - Time Measurement
1988-959,self-generating quartz analogue wristwatch,Seiko analogue quartz watch with automatic generating system,,,,,,Seiko analogue quartz watch with automatic generating system (Cal.7M22). Includes components in perspex case,WHOLE,SCM - Time Measurement
1969-513,weight-driven pendulum clocks; gravity escapements; turret clocks,"Three train, flatbed turret clock by E. Dent with double three-legged gravity escapement, c. 1939.","E.Dent and Co.Ltd; Grimthorpe, Edmund Beckett, Baron, 1816-1905",1939,"London, Greater London, England, United Kingdom",,,"Movement of a 3-train turret clock by E. Dent and Co., (made about 1939); the going train with Grimthorpe's double 3-legged gravity escapement; the striking train and Westminster quarters controlled by locking plates; with 1 1/2 second pendulum and double trestle frame for support",WHOLE,SCM - Time Measurement
1975-334,pocket watch; cylinder watch,"Pocket watch in silver and tortoiseshell case, with Tompion movement","Tompion, Thomas",1651-1700,"London, England, United Kingdom",tortoiseshell; silver (metal); steel (metal),"overall: 27 mm x 55 mm, weight: 0.115kg","Horizontal watch signed: 'T. Tompion London 3', now with cylinder escapement and dial signed 'Graham' in silver box and tortoiseshell outer case, watch originally by Thomas Tompion, London, England, 1650-1700.",WHOLE,SCM - Time Measurement
1975-338,,Time Recorder,Warwick Time Stamp Co.,,,iron; brass; glass,"overall: 287 mm x 230 mm x 186 mm,",Time Recorder by Warwick Time Stamp Co.,WHOLE,SCM - Time Measurement
1975-342,,"Observation table regulator, signed Grimalde and Johnson",Grimalde and Johnson (maker),,,,"overall: 270 mm x 245 mm x 145 mm,","Observation table regulator, signed Grimalde and Johnson",WHOLE,SCM - Time Measurement
1975-365,,Swiss 8-day watch,,,,,,Swiss 8-day watch,WHOLE,SCM - Time Measurement
1976-130,watch timer,'Meridian' watch timer,Walker Electronics (maker),1940-1976,"Newark-on-Trent, Nottinghamshire, England, United Kingdom",steel (metal); plastic (unidentified); stainless steel; electronic components,overall: 190 mm x 280 mm x 200 mm,"'Meridian' watch timer, by Walker Electronics, Newark-on-Trent, Nottinghamshire, England, 1940-1976.",WHOLE,SCM - Time Measurement
1980-808,chronometer,2-Day Marine chronometer movement with Hartnup's Balance Dia,"Bryer, J. (maker)",,"London, Greater London, England, United Kingdom",,,2-Day Marine chronometer movement with Hartnup's Balance Dial engraved J. Bryer 53 and 54 Barbican London 2485,WHOLE,SCM - Time Measurement
1980-834,,"Poole electric clock, patented 1927 and made by the Morse Ch",Morse Chain Co. (maker),,"Ithaca, Tompkins county, New York state, United States",,,"Poole electric clock, patented 1927 and made by the Morse Chain Co., Ithaca, N.Y. USA",WHOLE,SCM - Time Measurement
1980-1065,,Electrically rewound clock patented by Schild et cie in 1927,,,,,,Electrically rewound clock patented by Schild et cie in 1927,WHOLE,SCM - Time Measurement
1980-1066,,Clock with compound pendulum and unusual dead-beat escapemen,Kee-Less Clock Co. (maker),,,,,"Clock with compound pendulum and unusual dead-beat escapement by the Kee-Less Clock Company, patented in 1919",WHOLE,SCM - Time Measurement
1980-1067,,"Impulse dial with centre seconds, operated by a stepping mot",Gents (maker),,"Leicester, Leicester, England, United Kingdom",,,"Impulse dial with centre seconds, operated by a stepping motor. Made by Gents of Leicester and patented in 1945",WHOLE,SCM - Time Measurement
1980-1068,,An electric clock installation by Telefonbau und Normulzeit,Telefonbau und Normulzeit G.M.B.H. (maker),,,,overall:  in.,"An electric clock installation by Telefonbau und Normulzeit G.M.B.H. consisting of 2 synchronised master clocks (electricaly rewound) 2 impulse dials, a control box and power unit",WHOLE,SCM - Time Measurement
1980-1480,,"Jaquet Electric Stopclock driven by a Synchronous motor, no",,,,,"overall: 228 mm x 260 mm x 143 mm,","Jaquet Electric Stopclock driven by a Synchronous motor, no.135528",WHOLE,SCM - Time Measurement
1980-1487,clock - regulator,Regulator clock by Cope and Molyneux with Mudge's gravity es,Cope and Molyneux (maker),1822-1823,,,,Regulator clock by Cope and Molyneux with Mudge's gravity escapement (1822-23) with original hood,WHOLE,SCM - Time Measurement
1981-242,pocket watch,Silver chaise watch,Demange (maker),1850-1900,Europe,"enamel; glass; silver (metal); brass (copper, zinc alloy); steel (metal)","overall: 450 mm x 100 mm x 125 mm, weight: 0.68kg","Silver chaise watch with double Virgule Escapement, by Demange, Europe, 1850-1900. Repeating and alarm trains missing.",WHOLE,SCM - Time Measurement
1981-293,,"Synchronous clock at the non self-starting type by Muirhead,",Muirhead Ltd. (maker),1930,"Elmers End, Bromley, Greater London, England, United Kingdom; Kent, England, United Kingdom",,"overall: 155 mm x 175 mm x 65 mm,","Synchronous clock at the non self-starting type by Muirhead, c.1930",WHOLE,SCM - Time Measurement
1981-716,pocket watch; duplex watch,Duplex watch in silver pair case. Hall-mark 1806,,,,,,Duplex watch in silver pair case. Hall-mark 1806,WHOLE,SCM - Time Measurement
1981-470,Equinoctial sundial,Chinese bronze equatorial sundial with the Gnomon in the for,,,China,,,Chinese bronze equatorial sundial with the Gnomon in the form of two strings attached to a rotating pointer which indicates the hours,WHOLE,SCM - Time Measurement
1981-1732,,Quartz controlled time switch by Sangamo Time controls,Sangamo Weston Ltd. (maker),,,,,Quartz controlled time switch by Sangamo Time controls,WHOLE,SCM - Time Measurement
1981-1856,clock,Night clock by Joseph Knibb,"Knibb, Joseph (maker)",1675-1685,"London, England, United Kingdom","brass (copper, zinc alloy); wood (unidentified); glass; steel (metal)",overall: 528 mm x 350 mm x 156 mm,"Night clock with painted landscape on dial and painted angels that turn with movement, by Joseph Knibb, London, England, 1675-1685.",WHOLE,SCM - Time Measurement
1952-234,nocturnal; universal sundial,"Nocturnal and pocket universal sundial, both showing Italian",,,,steel; brass (alloy); leather; tooled; portable; chronological,diameter in case:  64 mm,"Nocturnal and pocket universal sundial, both showing Italian hours, steel and brass, 2 1/ 2"" diameter in shaped tooled-leather sling case, incomplete",WHOLE,SCM - Time Measurement
1988-724,,Spring-driven fusee timepiece movement with dovetail lever e,,,,,,"Spring-driven fusee timepiece movement with dovetail lever escapement. ""VULLIAMY. LONDON. No.1593. A.D.1843"" engraved on backplate",WHOLE,SCM - Time Measurement
1988-940,Inclined plate equinoctial sundial (gnomon is cylindrical lens),Sun-Glass sundial. An equinoctial dial with a translucent pl,,1988,"England, United Kingdom",,"overall: 458 mm x 118 mm x 118 mm,",Sun-Glass sundial. An equinoctial dial with a translucent plate and a gnomon in the form of a cylindrical lens,WHOLE,SCM - Time Measurement
1988-939,clock,Junghans RC2 radio controlled clock,Junghans Uhren GmbH,1988,Germany,plastic (unidentified); electric components,"overall: 98 mm x 150 mm x 68 mm, weight: 0.365kg","RC2 analogue quartz clock synchronised at hourly intervals by the radio time signal transmitted from Rugby, by Junghans Uhren GmbH, Germany, 1988.",WHOLE,SCM - Time Measurement
1988-1431,,"""Dreadnought"" bookmaker's bag by the Richmond Time Recording",,,,,,"""Dreadnought"" bookmaker's bag by the Richmond Time Recording Co., Classic Works, Howard St., Birmingham. Patented in 1925",WHOLE,SCM - Time Measurement
1988-1417,balance wheel analogue wristwatch,Braille wrist watch with a jewelled lever escapement by Rake,Raketa,,Russia,,,Braille wrist watch with a jewelled lever escapement by Raketa of the USSR,WHOLE,SCM - Time Measurement
1913-573,,"Copy of a merkhet and bay, ancient Egyptian instruments used",,,,,length 560 mm; width 210 mm; height 480 mm,"Copy of a merkhet and bay, ancient Egyptian instruments used for astronomical timekeeping (original is in the Royal Museum, Berlin). The merkhet is a bar with a plumb line used for measuring star transits; the bay is a forked stick used for alignment.",WHOLE,SCM - Time Measurement
1914-591,clock - regulator,"Clock used for transit of Venus observations, 1769","Shelton, John",1768-1769,"London, Greater London, England, United Kingdom",,,Regulator clock by John Shelton with glazed mahogany case.  One of five such clocks sent with Royal Society expeditions to observe the Transit of Venus on the 3rd June 1769.,WHOLE,SCM - Time Measurement
1916-318,Universal ring sundials,"Universal ring dial, by Adams; in mahogany case, no key, eng","Adams, George",1734-1796,"London, Greater London, England, United Kingdom",,length 310 mm; width 300 mm; height 450 mm,"Universal ring dial, by Adams; in mahogany case, no key, engraved made by Geo Adams at tycho brake's head in Fleet Street, London brass with silvered scales, diams of vertical divided circle 9"" horizontal and vertical circles divided in degrees, and reading to vernier by 5' hour circle divided to 2 min, 3 levelling screws hole sights fixed to vertical circle, slow motion by pinion for both vertical and horizontal circles",WHOLE,SCM - Time Measurement
1916-319,Universal ring sundial,"Universal ring dial, by liford, diam 9"" engraved:- J. Liford","Liford, John",1732-1751,,,"overall: 232 cm x 289 cm x 20 cm,","Universal ring dial, by liford, diam 9"" engraved:- J. Liford, maker in ye strand, London"" and ""B Scott, St. Petersburg"" (cursor missing)",WHOLE,SCM - Time Measurement
1918-100,Universal ring sundial,"Seven inch Universal ring dial by G. Adams, on mahogany stan","Adams, George",1734-1795,"London, Greater London, England, United Kingdom",,"overall: 295 mm x 265 mm x 30 mm, 230 mm,","Seven inch Universal ring dial by G. Adams, on mahogany stand, (case forms base of stand)",WHOLE,SCM - Time Measurement
